[
  {
    "book_id": 1,
    "chapter_id": 31,
    "hadith_id": 1,
    "arabic": "حَدَّثَنَا يَحْيَى بْنُ بُكَيْرٍ، حَدَّثَنَا اللَّيْثُ، عَنْ عُقَيْلٍ، عَنِ ابْنِ شِهَابٍ، قَالَ أَخْبَرَنِي أَبُو سَلَمَةَ، أَنَّ أَبَا هُرَيْرَةَ ـ رضى الله عنه ـ قَالَ سَمِعْتُ رَسُولَ اللَّهِ صلى الله عليه وسلم يَقُولُ لِرَمَضَانَ ‏\"‏ مَنْ قَامَهُ إِيمَانًا وَاحْتِسَابًا غُفِرَ لَهُ مَا تَقَدَّمَ مِنْ ذَنْبِهِ ‏\"‏‏.‏",
    "english": "Narrated Abu Huraira: I heard Allah's Messenger (ﷺ) saying regarding Ramadan, \"Whoever prayed at night in it (the month of Ramadan) out of sincere Faith and hoping for a reward from Allah, then all his previous sins will be forgiven.\"",
    "bangla": "আবূ হুরায়রা (রাঃ) থেকে বর্ণিতঃ তিনি বলেন, আমি আল্লাহর রসূল (সাল্লাল্লাহু ‘আলাইহি ওয়া সাল্লাম) - কে রমযান সম্পর্কে বলতে শুনেছি, যে ব্যক্তি রমযানে ঈমানের সাথে সওয়াব লাভের আশায় কিয়ামে রমযান অর্থাৎ তারাবীর সালাত আদায় করবে তার পূর্ববর্তী গোনাহসমূহ মাফ করে দেয়া হবে।"
  },
  {
    "book_id": 1,
    "chapter_id": 31,
    "hadith_id": 2,
    "arabic": "حَدَّثَنَا عَبْدُ اللَّهِ بْنُ يُوسُفَ، أَخْبَرَنَا مَالِكٌ، عَنِ ابْنِ شِهَابٍ، عَنْ حُمَيْدِ بْنِ عَبْدِ الرَّحْمَنِ، عَنْ أَبِي هُرَيْرَةَ ـ رضى الله عنه ـ أَنَّ رَسُولَ اللَّهِ صلى الله عليه وسلم قَالَ ‏\"‏ مَنْ قَامَ رَمَضَانَ إِيمَانًا وَاحْتِسَابًا غُفِرَ لَهُ مَا تَقَدَّمَ مِنْ ذَنْبِهِ ‏\"‏‏.‏ قَالَ ابْنُ شِهَابٍ فَتُوُفِّيَ رَسُولُ اللَّهِ صلى الله عليه وسلم وَالأَمْرُ عَلَى ذَلِكَ، ثُمَّ كَانَ الأَمْرُ عَلَى ذَلِكَ فِي خِلاَفَةِ أَبِي بَكْرٍ وَصَدْرًا مِنْ خِلاَفَةِ عُمَرَ ـ رضى الله عنهما.‏",
    "english": "Narrated Abu Huraira: Allah's Messenger (ﷺ) said, \"Whoever prayed at night the whole month of Ramadan out of sincere Faith and hoping for a reward from Allah, then all his previous sins will be forgiven.\" Ibn Shihab (a sub-narrator) said, \"Allah's Messenger (ﷺ) died and the people continued observing that (i.e. Nawafil offered individually, not in congregation), and it remained as it was during the Caliphate of Abu Bakr and in the early days of 'Umar's Caliphate.\"",
    "bangla": "আবূ হুরায়রা (রাঃ) থেকে বর্ণিতঃ আল্লাহর রসূল (সাল্লাল্লাহু ‘আলাইহি ওয়া সাল্লাম) বলেছেন, যে ব্যক্তি রমযানে ঈমানের সাথে সওয়াব লাভের আশায় তারাবীর সালাতে দাঁড়াবে তার পূর্ববর্তী গোনাহসমূহ মাফ করে দেয়া হবে। হাদীসের রাবী ইব্‌নু শিহাব (রহঃ) বলেন, আল্লাহর রসূল (সাল্লাল্লাহু ‘আলাইহি ওয়া সাল্লাম) ইনতিকাল করেন এবং তারাবীর ব্যাপারটি এভাবেই চালু ছিল। এমনকি আবূ বকর (রাঃ)- এর খিলাফতকালে ও ‘উমর (রাঃ)- এর খিলাফতের প্রথমভাগে এরূপই ছিল।"
  },
  {
    "book_id": 1,
    "chapter_id": 31,
    "hadith_id": 3,
    "arabic": "وَعَنِ ابْنِ شِهَابٍ، عَنْ عُرْوَةَ بْنِ الزُّبَيْرِ، عَنْ عَبْدِ الرَّحْمَنِ بْنِ عَبْدٍ الْقَارِيِّ، أَنَّهُ قَالَ خَرَجْتُ مَعَ عُمَرَ بْنِ الْخَطَّابِ ـ رضى الله عنه ـ لَيْلَةً فِي رَمَضَانَ، إِلَى الْمَسْجِدِ، فَإِذَا النَّاسُ أَوْزَاعٌ مُتَفَرِّقُونَ يُصَلِّي الرَّجُلُ لِنَفْسِهِ، وَيُصَلِّي الرَّجُلُ فَيُصَلِّي بِصَلاَتِهِ الرَّهْطُ فَقَالَ عُمَرُ إِنِّي أَرَى لَوْ جَمَعْتُ هَؤُلاَءِ عَلَى قَارِئٍ وَاحِدٍ لَكَانَ أَمْثَلَ‏.‏ ثُمَّ عَزَمَ فَجَمَعَهُمْ عَلَى أُبَىِّ بْنِ كَعْبٍ، ثُمَّ خَرَجْتُ مَعَهُ لَيْلَةً أُخْرَى، وَالنَّاسُ يُصَلُّونَ بِصَلاَةِ قَارِئِهِمْ، قَالَ عُمَرُ نِعْمَ الْبِدْعَةُ هَذِهِ، وَالَّتِي يَنَامُونَ عَنْهَا أَفْضَلُ مِنَ الَّتِي يَقُومُونَ‏.‏ يُرِيدُ آخِرَ اللَّيْلِ، وَكَانَ النَّاسُ يَقُومُونَ أَوَّلَهُ‏.‏",
    "english": "'Abdur Rahman bin 'Abdul Qari said, \"I went out in the company of 'Umar bin Al-Khattab one night in Ramadan to the mosque and found the people praying in different groups. A man praying alone or a man praying with a little group behind him. So, 'Umar said, 'In my opinion I would better collect these (people) under the leadership of one Qari (Reciter) (i.e. let them pray in congregation!)'. So, he made up his mind to congregate them behind Ubai bin Ka'b. Then on another night I went again in his company and the people were praying behind their reciter. On that, 'Umar remarked, 'What an excellent Bid'a (i.e. innovation in religion) this is; but the prayer which they do not perform, but sleep at its time is better than the one they are offering.' He meant the prayer in the last part of the night. (In those days) people used to pray in the early part of the night.\"",
    "bangla": "‘আবদুর রাহমান ইবনু ‘আবদ আল-ক্বারী (রহঃ) থেকে বর্ণিতঃ তিনি বলেন, আমি রমযানের এক রাতে ‘উমর ইবনুল খাত্তাব (রাঃ)- এর সাথে মসজিদে নাবাবীতে গিয়ে দেখি যে, লোকেরা এলোমেলোভাবে জামা’আতে বিভক্ত। কেউ একাকী সালাত আদায় করছে আবার কোন ব্যক্তি সালাত আদায় করছে এবং ইকতেদা করে একদল লোক সালাত আদায় করছে। ‘উমর (রাঃ) বললেন, আমি মনে করি যে, এই লোকদের যদি আমি একজন ক্বারীর (ইমামের) পিছনে জমা করে দেই, তবে তা উত্তম হবে। এরপর তিনি ‘উবাই ইব্‌নু ‘কাব (রাঃ)- এর পিছনে সকলকে জমা করে দিলেন। পরে আর এক রাতে আমি তাঁর [‘উমর (রাঃ)] সাথে বের হই। তখন লোকেরা তাদের ইমামের সাথে সালাত আদায় করছিল। ‘উমর (রাঃ) বললেন, কত না সুন্দর এই নতুন ব্যবস্থা! তোমরা রাতের যে অংশে ঘুমিয়ে থাক তা রাতের ঐ অংশ অপেক্ষা উত্তম যে অংশে তোমরা সালাত আদায় কর, এর দ্বারা তিনি শেষ রাত বুঝিয়েছেন, কেননা তখন রাতের প্রথমভাগে লোকেরা সালাত আদায় করত।"
  },
  {
    "book_id": 1,
    "chapter_id": 31,
    "hadith_id": 4,
    "arabic": "حَدَّثَنَا إِسْمَاعِيلُ، قَالَ حَدَّثَنِي مَالِكٌ، عَنِ ابْنِ شِهَابٍ، عَنْ عُرْوَةَ بْنِ الزُّبَيْرِ، عَنْ عَائِشَةَ، رضى الله عنها زَوْجِ النَّبِيِّ صلى الله عليه وسلم أَنَّ رَسُولَ اللَّهِ صلى الله عليه وسلم صَلَّى وَذَلِكَ فِي رَمَضَانَ‏.‏",
    "english": "Narrated `Aisha: (the wife of the Prophet) Allah's Messenger (ﷺ) used to pray (at night) in Ramadan.",
    "bangla": "নবী-সহধর্মিণী ‘আয়িশা (রাঃ) থেকে বর্ণিতঃ আল্লাহর রসূল (সাল্লাল্লাহু ‘আলাইহি ওয়া সাল্লাম) সালাত আদায় করেন এবং তা ছিল রমযানে।"
  },
  {
    "book_id": 1,
    "chapter_id": 31,
    "hadith_id": 5,
    "arabic": "حَدَّثَنَا يَحْيَى بْنُ بُكَيْرٍ، حَدَّثَنَا اللَّيْثُ، عَنْ عُقَيْلٍ، عَنِ ابْنِ شِهَابٍ، أَخْبَرَنِي عُرْوَةُ، أَنَّ عَائِشَةَ ـ رضى الله عنها ـ أَخْبَرَتْهُ أَنَّ رَسُولَ اللَّهِ صلى الله عليه وسلم خَرَجَ لَيْلَةً مِنْ جَوْفِ اللَّيْلِ، فَصَلَّى فِي الْمَسْجِدِ، وَصَلَّى رِجَالٌ بِصَلاَتِهِ، فَأَصْبَحَ النَّاسُ فَتَحَدَّثُوا، فَاجْتَمَعَ أَكْثَرُ مِنْهُمْ، فَصَلَّوْا مَعَهُ، فَأَصْبَحَ النَّاسُ فَتَحَدَّثُوا، فَكَثُرَ أَهْلُ الْمَسْجِدِ مِنَ اللَّيْلَةِ الثَّالِثَةِ، فَخَرَجَ رَسُولُ اللَّهِ صلى الله عليه وسلم فَصَلَّى، فَصَلَّوْا بِصَلاَتِهِ، فَلَمَّا كَانَتِ اللَّيْلَةُ الرَّابِعَةُ عَجَزَ الْمَسْجِدُ عَنْ أَهْلِهِ، حَتَّى خَرَجَ لِصَلاَةِ الصُّبْحِ، فَلَمَّا قَضَى الْفَجْرَ أَقْبَلَ عَلَى النَّاسِ، فَتَشَهَّدَ ثُمَّ قَالَ ‏\"‏ أَمَّا بَعْدُ، فَإِنَّهُ لَمْ يَخْفَ عَلَىَّ مَكَانُكُمْ، وَلَكِنِّي خَشِيتُ أَنْ تُفْتَرَضَ عَلَيْكُمْ فَتَعْجِزُوا عَنْهَا ‏\"‏‏.‏ فَتُوُفِّيَ رَسُولُ اللَّهِ صلى الله عليه وسلم وَالأَمْرُ عَلَى ذَلِكَ",
    "english": "Narrated 'Urwa: That he was informed by `Aisha, \"Allah's Messenger (ﷺ) went out in the middle of the night and prayed in the mosque and some men prayed behind him. In the morning, the people spoke about it and then a large number of them gathered and prayed behind him (on the second night). In the next morning the people again talked about it and on the third night the mosque was full with a large number of people. Allah's Messenger (ﷺ) came out and the people prayed behind him. On the fourth night the Mosque was overwhelmed with people and could not accommodate them, but the Prophet (ﷺ) came out (only) for the morning prayer. When the morning prayer was finished he recited Tashah-hud and (addressing the people) said, \"Amma ba'du, your presence was not hidden from me but I was afraid lest the night prayer (Qiyam) should be enjoined on you and you might not be able to carry it on.\" So, Allah's Apostle died and the situation remained like that (i.e. people prayed individually). \"",
    "bangla": "‘আয়িশা (রাঃ) থেকে বর্ণিতঃ তিনি বলেন, আল্লাহর রসূল (সাল্লাল্লাহু ‘আলাইহি ওয়া সাল্লাম) গভীর রাতে বের হয়ে মসজিদে সালাত আদায় করেন, কিছু সংখ্যক পুরুষ তাঁর পিছনে সালাত আদায় করেন। সকালে লোকেরা এ সম্পর্কে আলোচনা করেন, ফলে লোকেরা অধিক সংখ্যায় সমবেত হন। তিনি সালাত আদায় করেন এবং লোকেরা তাঁর সঙ্গে সালাত আদায় করেন। সকালে তাঁরা এ বিষয়ে আলাপ-আলোচনা করেন। তৃতীয় রাতে মসজিদে মুসল্লীর সংখ্যা আরো বেড়ে যায়। এরপর আল্লাহর রসূল (সাল্লাল্লাহু ‘আলাইহি ওয়া সাল্লাম) বের হয়ে সালাত আদায় করেন ও লোকেরা তাঁর সঙ্গে সালাত আদায় করেন। চতুর্থ রাতে মসজিদে মুসল্লীর সংকুলান হল না, কিন্তু তিনি রাতে আর বের না হয়ে ফজরের সালাতে বেরিয়ে আসলেন এবং সালাত শেষে লোকদের দিকে ফিরে প্রথমে তাওহীদ ও রিসালতের সাক্ষ্য দেয়ার পর বললেনঃ শোন! তোমাদের (গতরাতের) অবস্থান আমার অজানা ছিল না, কিন্তু আমি এই সালাত তোমাদের উপর ফরয হয়ে যাবার আশংকা করছি (বিধায় বের হই নাই) কেননা তোমরা তা আদায় করায় অপারগ হয়ে পড়তে। আল্লাহর রসূল (সাল্লাল্লাহু ‘আলাইহি ওয়া সাল্লাম) -এর ওফাত হলো আর ব্যাপারটি এভাবেই থেকে যায়।"
  },
  {
    "book_id": 1,
    "chapter_id": 31,
    "hadith_id": 6,
    "arabic": "حَدَّثَنَا إِسْمَاعِيلُ، قَالَ حَدَّثَنِي مَالِكٌ، عَنْ سَعِيدٍ الْمَقْبُرِيِّ، عَنْ أَبِي سَلَمَةَ بْنِ عَبْدِ الرَّحْمَنِ، أَنَّهُ سَأَلَ عَائِشَةَ ـ رضى الله عنها ـ كَيْفَ كَانَتْ صَلاَةُ رَسُولِ اللَّهِ صلى الله عليه وسلم فِي رَمَضَانَ فَقَالَتْ مَا كَانَ يَزِيدُ فِي رَمَضَانَ، وَلاَ فِي غَيْرِهَا عَلَى إِحْدَى عَشْرَةَ رَكْعَةً، يُصَلِّي أَرْبَعًا فَلاَ تَسَلْ عَنْ حُسْنِهِنَّ وَطُولِهِنَّ، ثُمَّ يُصَلِّي أَرْبَعًا فَلاَ تَسَلْ عَنْ حُسْنِهِنَّ وَطُولِهِنَّ، ثُمَّ يُصَلِّي ثَلاَثًا‏.‏ فَقُلْتُ يَا رَسُولَ اللَّهِ، أَتَنَامُ قَبْلَ أَنْ تُوتِرَ قَالَ ‏\"‏ يَا عَائِشَةُ إِنَّ عَيْنَىَّ تَنَامَانِ وَلاَ يَنَامُ قَلْبِي ‏\"‏‏.‏",
    "english": "Narrated Abu Salama bin `Abdur Rahman: that he asked `Aisha \"How was the prayer of Allah's Messenger (ﷺ) in Ramadan?\" She replied, \"He did not pray more than eleven rak`at in Ramadan or in any other month. He used to pray four rak`at ---- let alone their beauty and length----and then he would pray four ----let alone their beauty and length ---- and then he would pray three rak`at (witr).\" She added, \"I asked, 'O Allah's Messenger (ﷺ)! Do you sleep before praying the witr?' He replied, 'O `Aisha! My eyes sleep but my heart does not sleep.\"",